,productId,Title,userId,Helpfulness,Score,Time,Text,Cat1,Cat2,Cat3,tokens,keyatm_label,Accuracy
5445,B0006UONMU,Calmoseptine Ointment - 2.47 Oz Jar - Each,A2PH80GZERPNVU,2/2,5.0,1134432000,"When my 10 month old had diarrhea for two weeks and developed truly horrifying diaper rash, a friend of mine who is an RN turned me on to this stuff. It began working IMMEDIATELY! The rash healed completely after just a few days with calmoseptine, though it previously had gotten worse and worse with my use of other assorted diaper rash creams. A little goes a LONG way, so I think a 4 oz. tube would last through several children's diaper years.",health personal care,health care,first aid,82,beauty,False
24370,B0000ZHH5G,Pharmaceutical Specialties Vanicream Skin Cream,ADDFT979OJR2B,2/2,5.0,1281398400,My dermatologist first recommended this cream for an eczema problem on my arm. It is also a great moisturizer if you wash your hands a lot and works in to the skin and dries pretty quickly.,beauty,skin care,body,36,beauty,True
21715,B000BXSTY0,Butler NutriSentials Lean Treats for Dogs,A3GY7IB30X8QM5,0/0,5.0,1264982400,"I first got these treats from my vet. My puppies loved them. The Lean treats are small and a great size for training. Being that they are lean makes them healthier for them.I have a tendency to ""over treat"" so by giving them the Lean treats I am at least treating them with a better treat.I order these all the time.",pet supplies,dogs,treats,61,pet supplies,True
25708,B0006FMVMY,"YML 3/8-Inch Bar Spacing ShellTop Small Bird Cage, 18-Inch by 14-Inch, Black",A1T8ZCP5LX308Y,2/2,3.0,1288656000,I just put this cage and stand together. The stand has no instructions and took me 45 minutes to figure it out but it seems sturdy. The cage is a basic wire cage and unfortunately mine came slightly bent so it took some adjusting to fit together. There is also no platform for the cage to sit on it just sits in side the frame of the stand so I've already found out it's easy to topple over when rolling the stand-I suggest using twistie ties to anchor to the stand frame. Over all it would cost more at a local pet store so I'll see how it does. The stand should have instructions to it and the frame has many more holes in it for screws so it's a guessing game. Fit the wire storage bottom first before trying to piece it all.,pet supplies,birds,cages accessories,144,baby products,False
25008,B00004WJSN,ThinkFun Rush Hour Jr.,A33MQ5EVDOLSWT,0/0,5.0,1284854400,"I let my 4- and 7-year-old girls play this cooperatively, taking turns, and it is just ridiculously awesome to watch them work out these puzzles together. An absolutely perfect little game/toy/puzzle/whatever. Compared to other logic puzzles, the goal is just so very *tangible*, which is fantastic motivation. I mean",toys games,games,board games,49,toys games,True
27410,B0002GPWB4,THE BARON by LTL COLOGNE SPRAY 4.2 OZ,A1HSOYL3Q5TX6H,0/0,5.0,1295827200,"This is a very hard product to find. I bought it on Amazon from a company called Perfumania. Unfortunately, I did not get to rate them in time, but they are GREAT SELLERS! I would recommend them to anyone. They even sent me a sample of another great fragrance in with my order. Thank you Perfumania!",beauty,fragrance,men s,56,beauty,True
38018,B000LSZVJQ,Fisher-Price Brilliant Basics Stack & Roll Cups,A1L85O96S49ID9,0/0,4.0,1336867200,"My 13 month son has had this toy for 6 months now and still loves it. Hes too young to grasp the counting/stacking concept, but he LOVES to roll and scoot them around the floor. I put them in to ball shapes and he will roll them around for 20-25 minutes at one time, which is about 1 hour in 13 month old time! He also loves to pick them up and slap them on the hard floor to make the noise and clacking sound. This is a wonderful toy and well made with bright vivid colors.",toys games,baby toddler toys,stacking nesting toys,97,toys games,True
13346,B0006Q0HEC,Wen by Chaz Dean Tea Tree Cleansing Conditioner 16 oz.,AV5FPUD7SVE8B,1/2,5.0,1207353600,"My whole family loves the Wen Tea Tree, especially my husband. He says he never thought it would get his hair so clean and it stays clean longer.I use another flavor all over and put the Tea Tree on top for volume on the top of my hair. My husband also uses this for dry skin on his face and it has worked wonders.",beauty,hair care,shampoo plus conditioner,64,beauty,True
3911,B0002GN6JY,S'Mores Maker,A122GYXYZPSR0X,0/0,2.0,1112054400,I bought this toy at christmas because my daughters love to make smores. I have been dissappointed though since it does not seem to get hot enough to actually melt the marshmellows. I have bought the recommended bulb at the recommneded wattage and it still does not seem to work very well. This toy has been dissapointing.....,toys games,dress up pretend play,pretend play,57,toys games,True
6789,B00032G1S0,"Tuscan Whole Milk, 1 Gallon, 128 fl oz",A3P83VZS0AVC75,14/15,5.0,1153440000,"I absolutely love this milk. It goes great with Honeybunches, Sugarplums, Pumpy-umpy-umpkins, Sweetie Pies, Cuppycakes, Gumdrops, Snoogums-Boogums, and Apples in my eyes. A must buy. And if you have the cash, try this milk with kitty toast. Highly recommended.",grocery gourmet food,dairy eggs,milk,39,grocery gourmet food,True
17393,B000C1Z4UI,Provocative Eau de Parfum for Women by Elizabeth Arden,A2W0O92FZFHJOJ,6/6,4.0,1234656000,"I got this fragrance for my mom a couple of years ago (she's a Arden Fiend) and she loved it and I didn't find it half-bad either. This flowery fragrance is sure to allure and amaze for it's . . . PROVOCATIVE!*It's high notes include rose, jasmine, and cassis*Mid-notes include peach, lemon, and bergamot (a common ingredient in Earl Grey tea)*Low notes included sandalwood, amber and white muskTips/Suggestions/Comments inolving Provocative:1) It's a fragrance of moderate strength . .Not too subtle and not too intense . .Jussstt right~2) It lasts around the same time as most perfumes (which is around 8 hours)3) This perfume, as Amazon said, is most good for evening use (though I think you could pass off with using it casually)4) I'd say this pefume is more for adults than teens . .I just think adults would appreciate it more, that's all . . .Though teens could like it too I guess (there are always exceptions to everything, right?)",beauty,fragrance,women s,161,beauty,True
5589,B000B6MLWI,My First Dollhouse,A3SDCYZH5V23SI,3/3,5.0,1135987200,Our daughter is 18 months old and has truly enjoyed her new gift from Santa. I agree that the furniture has been very difficult to find. The doorbell and telephone sounds are great and it seems to be a very durable toy. She loves it!,toys games,action toy figures,figures,45,toys games,True
21278,B000I8SNNA,Plan Toys Cooking Utensils,A29HWEN7ZBFENT,2/2,1.0,1262563200,"I consider toys by Plan Toys as high quality, aesthetically pleasing, extremely durable,... and high price. This toy only has the high price in common with what I am used to from Plan Toys. The pots are ugly, very flimsy, and got dented within minutes of giving them to my kids. The metal has the stability of a coke can -- the formerly round pots are now egg shaped and won't sit flat on the ""cook top"" anymore -- and the wooden lids have now become useless too. IKEA carries a much more cute, much more sturdy line of cooking, baking, and serving utensils at a MUCH better value. I really hope this will be my only disappointing purchase from Plan Toys.",toys games,dress up pretend play,pretend play,122,toys games,True
30931,B0009N5EZY,Kenneth Cole Reaction by Kenneth Cole Eau De Toilette Spray 3.4 oz for Men,A3K7TT62M1R99A,0/0,2.0,1311292800,I had another bottle of Reaction when I got this one and did a scent comparison of name brand vs what I was delivered and the result was the amazing scent I was used to was now marred by a sharp edge. I have sworn by this cologne and used it for years and what I received was not what I have bought in years past.,beauty,fragrance,men s,66,beauty,True
36302,B0009XJQ0I,"World's Best 00098 Cat Litter, Clumping Formula",A3TJQC7N2PXLZ0,0/0,5.0,1330300800,I am not a Disappointed Purchaser. I clicked 5 stars. Hmmm.This is a great product. I wouldn't go back to using clay litter for all of the tea in China.*Clumps extremely well*No wet cement residue left on bottom or sides of box or on the floor*Can be flushed down the toilet - have been doing so for over three years now. I DO NOT MISS stinky can I used to collect the waste in.*Very light weight-easy to move a box around when necessary*One problem is that if you add clean litter to the top the bottom litter breaks down into a powdery substance that is then tracked. I wash out the boxes every couple of weeks and solved about 99% of this by first pouring a fresh batch of litter in the clean box and added the previous litter on top where it is scooped out first.*It is a bit on the expensive side but does last quite a while as the clumping ability is so excellent that not a piece of litter is wasted.,pet supplies,cats,food,175,pet supplies,True
25293,B000HDH02Q,Battat Krinkles 113 Pieces,ATJI5DPK9OVV,0/0,5.0,1286323200,Keeps my kids entertained for ages (mine little ones are aged 5 to 9 now but we have had these blocks for 2 years & just keep building up our stock. 3 year olds can have lots of fun with these krinkles. You can't go wrong with this purchase.,toys games,building toys,building sets,49,toys games,True
16157,B000JOT2RO,Munchkin Three Stay Put 3-Pack Suction Bowl,A3SDW82H8PVI3S,0/0,3.0,1228176000,"I like these bowls, but the suction could stand to be a bit stronger. Even when moistened, the suction still gives way after a few tugs... at least it doesn't fly right off though I suppose.",baby products,feeding,solid feeding,36,health personal care,False
16083,B000H2278E,"Miller's Ham Flavored Base, 16-Ounce Packs (Pack of 6)",A1ETE4DII8NLX7,2/2,5.0,1227657600,This ham base adds a lot of flavor. It is much better than another brand I have tried. I will certainly buy again. I received it from Amazon.com in just 2 days with free shipping.,grocery gourmet food,pantry staples,canned jarred food,35,grocery gourmet food,True
22765,B000HHQ2I0,Super Pet Small Animal Critter Trail Playpen with Mat,AL59B6XONQW6C,9/9,1.0,1270771200,"The idea is great- your hamster comes out into a more open space and your can play with him easier.The execution is horrible. As many have noted, the hamster can escape fairly easily. The mat can move and tear pretty easily.The other issue for us is our hamster can move the entire cage easily, pushing it off the mat. Then he starts tearing at the carpet. It also creates bends that make escape easier, and their is the risk of it falling over.This is annoying because for a little extra design it would be perfect- a little higher, a little strong, a little thicker mat.Maybe it works better for mice or dwarf hamsters, but I've read of dwarfs also escaping.After a while, the fun of the playpen is lost due to the constant fear of escape and the constant need to be readjusting.I am going to look for a open top aquarium and make my own.",pet supplies,bunny rabbit central,houses habitats,156,pet supplies,True
25291,B000F3QG0U,"HoMedics SS-2000E Sound Spa Nature Sounds Machine with 6 Nature Sounds, Silver",A1FPHNUYPWSSWP,0/0,4.0,1286323200,"If you're as anxious and analytical as I am you'll likely pick up patterns in most of these sounds. If you listen carefully, you can detect where the sound loops. I think it's about 10-15 seconds long. Once you hear that the sound becomes more annoying than no sound. HOWEVER... the waterfall sound is excellent. It's too white-noisy to be able to detect any pattern, so I can rest without 'hearing' it. So with that caveat, I would definitely recommend this product for anyone who likes white noise to sleep or drown out something else.",health personal care,health care,alternative medicine,95,toys games,False
25307,B000OZDZ7G,Duro-Med Relax-a-Bac with Insert and Strap,A1QV6WTRVHK7WV,0/0,5.0,1286409600,"I never used to have lower back problems, but have been in pain for about a month now after sitting at my ergonomically-correct desk chair. I was a little skeptical of these, but figured it was worth a shot. I used this yesterday and it was like a miracle! I am so glad I got this. The strap doesn't really keep it in place, so if I leave the chair I do have to re-adjust, but no big deal. Love it.",health personal care,medical supplies equipment,braces,81,health personal care,True
29489,B00067AUP2,"Dexbaby Safe Lift Universal Crib Wedge, White",A3N9L7XTHM6FDZ,7/16,1.0,1304985600,i did not get this product from this website but a similar item was given to me as a present Thank goodness i didn't use it because it was recalled. Babies were rolling over and suffocating. Just wanted to pass on the warning,baby products,safety,sleep positioners,43,grocery gourmet food,False
20003,B0007Y5C52,Body Toolz Electric Manicure Pedicure Kit,AD6QOWR55VW18,8/9,5.0,1254009600,I AM HANDICAPPED- CAN'T CUT MY NAILS ANY LONGER- MY HUSBAND FILES MY TOE NAILS DOWN - AND I FILE MY FINGERNAILS DOWN- AM SO HAPPY WITH MY PEDICURE SET--THANK YOU VERY MUCH-MRS. DELORES ROSENKILDE,beauty,tools accessories,nail tools,35,beauty,True
32799,B00061RHO0,K&H Thermo-Kitty Sill Seat,A2EG48ZK5YIXUD,1/1,1.0,1318896000,"The velcro attachments were way too small, not strong enough to keep sill attached - in fact, I came home to find a very unhappy cat and discovered the kitty sill on the floor. Also, the plastic legs are flimsy and kept coming out of the slots in the sill. I have had a better kitty sill before. Sorry I wasted the money on this one.",pet supplies,cats,beds furniture,66,pet supplies,True
25322,B000AA5VJU,Sally Hansen Brush-On Facial Hair Remover,A1874VN8GCA79E,2/2,1.0,1286582400,"I tried this product and only left it on for 2 minutes, but then it started to burn. After removing the product, my skin was really red. In addition, I am dark skinned so to have visible redness is pretty bad. I can't do anything with my skin excpet apply coco butter on it to help, but it hurts even when I wash my face.My skin is prone to acne and using this product has made it worst. I use Differin and I can't use it when my skin is like this, not to mention, using coco butter is not helping my pores but it is the only thing I can find that helps.",beauty,skin care,unknown,114,beauty,True
32289,B000PC98A6,"Luna Bars, 1.69-Ounce Bars",A3NVML5QD90ADG,0/2,5.0,1316908800,"I've eaten Luna bars for years -- and love them. This price point made me want to order them online -- with the recurring feature. I wanted to cut down on the waste associated with mailing packages -- so tried to order 6 cases at a time, every six months (rather than a case every month). I even called and spoke to a sales associate. What happened? A few days later, a single case arrived in the mail... *sigh.* So the price and product were fine, but the service has a LONG way to go.",health personal care,nutrition wellness,vitamins supplements,95,health personal care,True
33011,B000HQHUFA,Angels' Eyes Tear-Stain Eliminator for Dogs and Cats,AAXLH006WJORT,0/0,5.0,1319587200,we have a 10 year old bishon frise and he has always had what i call black lava crusting around his eyes his previous owners tried everything the vet gave them and more to clear it up and nothing worked. so as a last ditch effort on my part i decided to try angel eyes. it took about a month to start seeing a difference but WOW what a difference it was no more black lava i can see his eyes and even his beard is coming in white. i would absolutely suggest this to anyone who's pet has a problem with stains or worse. just make sure to reorder before you run out i waited till i was out and had to wait a cpl of weeks and started to see the black coming back.,pet supplies,dogs,health supplies,136,beauty,False
11011,B000LP40FU,Graco Silhouette Infant Swing in Legacy,A1MY1CZM8QHFGJ,2/3,5.0,1191542400,"When we were looking at baby swings for our second son, I decided I wanted one with a five point harness. It turned out to be a great investment because our toddler liked to push his baby brother in the swing when I wasn't looking. I think this swing saved our little one! He really like the white noise generator and nature sounds and the sound quality on the music isn't too baby (kinda like Baby Einstein). One set of batteries lasted us about three months. Good buy! One downside- the recline on the seat, while comparable to most other baby swings, wasn't as much as I wanted it to be for a small baby.",baby products,gear,swings,115,baby products,True
7052,B000B74EIQ,Disney Mack Truck Playset,A32BZK528N8TCA,20/87,1.0,1157241600,"O.k. Can someone explain to me why a 4- to 8-year-old needs a toy called a Bachelor Pad that expresses the ""racy"" side of this movie character? I don't care how much fun your kid has playing with it, it's not appropriate. When are we parents going to open our eyes and pay attention to what the manufacturers are selling our children?",toys games,vehicles remote control,play vehicles,62,toys games,True
10903,B000OWN65U,"Alli Weight-Loss Aid, Orlistat 60mg Capsules, Starter Pack",A3IOFY6T1JXU68,7/11,5.0,1190764800,"I bought my 90 capsules on Monday. I am now on day three. So far, I am happy.I know that if I eat anything FATTY that I will experience the side effects! Duhhhhhhhhhh!!! It doesn't curb your appetite, race your heart-none of the things you expect from a diet pill.Once you eat something fatty-expect to go to the bathroom. You don't want to soil yourself-THEN EAT RIGHT!I am using this as a jumpstart, not a CURE. Monday I ate what I wanted. Yesterday I felt bloated. I ran back and forth all early morning today to the toilet.(3am est) Stomache is still bubbling, but I have a handle on it.It's pretty simple",health personal care,nutrition wellness,weight loss products,112,pet supplies,False
15423,B0002J1FLW,Merial Frontline Plus Flea and Tick Control for Dogs and Puppies,ADLVFFE4VBT8,0/0,4.0,1222732800,"Our 2 puppies got it this year and, as far as I can tell, they are bug-free so far. I can't say whether this is because of Frontline or because there are no fleas in surroundings but, until evidence to the contrary emerges, I will give Frontline the credit.The makers claim that Frontline Plus kills all fleas and prevents re-infestation for up to one month. For 'paralysis tick' protection, bi-weekly application is recommended but results are not guaranteed.The product comes in a number of 'pipettes' that contain an oily-sticky liquid that is applied on the back of the dog's neck's, on the skin (must part the coat until the skin is visible). The makers recommend monthly applications.I found it easy to treat the dogs. Given the relatively high price of this product, I've been using one pipette for our 2 puppies. As they are now big, this may no longer be an option but I can see how this option could be a money saver for anyone who has 2 'not so large' dogs.I am taking one star away because of the ridiculously high price.",pet supplies,dogs,health supplies,185,pet supplies,True
18884,B0002A65LQ,help me | retinol treatment | philosophy,A2WV3PH046VUK8,20/22,5.0,1245110400,"For years I've used Proactiv on and off for my battle with acne. Proactiv has proved effective over the years but I had a few problems with the products:1. The Price... For a cleanser, toner and moisturizer I was paying $45 dollars a month.2. The Amount... I could NEVER get the cleanser and toner to last me the full month. To cover my face I needed half the bottle, and it is NOT an effective makeup remover.3. Dryness... dried my skin out BAD. And the moisturizer sucked, but I couldn't customize my order to remove it.After much research, debate and watching the infomercial over several times over I decided to switch to Philosophy. Now if you purchase Philosophy products individually it does get pretty spendy, but no more or less than other department store facial products. As a package it's a helluva deal.I got the cleanser, moisturizer, retinol, exfoliating cleanser, eye/lip cream, shampoo/body wash, lip gelato, another exfoliating cream, and the Vitamin C booster AND A FREE GIFT for LESS than what I paid for my three rinky dinky Proactiv products.For 8 products I paid $109.00 for 3 months. 3 months of Proactiv is $135, at the least.The Philosophy product themselves have been life changing for me. If I absolutely had to choose one that I love the best I would have to say it's the Help Me.This stuff is absolutely amazing. My skin is very sensitive to retinol, and continuous use of it for me on a weekly basis usually leads to a rash. This product seems to have enough retinol to do the job, but not enough to make me get a burn. I swear, within a FEW DAYS I noticed a difference, and I wasn't the only one. My husband has raved about the lack of lines under my eyes, and swear the product has taken years off of my face. Like all of Philosophy's stuff a little goes a long way, and always put moisturizer on afterwards, especially with the Help Me. Retinol is extremely beneficial to skin, but one must handle it with care. Frankly, I am not sure if it is the Help Me alone that has done it, or a combination of the Philosophy products I have invested in. Either which way, I have become a true lover of their products!!!",beauty,makeup,face,388,beauty,True
34055,B000JMG72O,"Fleece Hang-N-Hammock ,Colors may Vary",AQCLKW77ILT4Q,3/3,5.0,1323475200,"The product came super fast..packed very well..easy to use and install and my cats love them!!! From the time they were small kittens, they have climbed into the little hammocks and ""hung"" out with their sisters and brothers!! Great product...and it holds up under 4 cats climbing in and out at about 8 pounds each!",pet supplies,bunny rabbit central,houses habitats,55,pet supplies,True
24850,B000EGEX2G,Stork Craft Hoop Glider & Ottoman,A70MPYCH5XIL0,0/0,5.0,1284076800,I purchased this for my daughter and my new grandson and they love it great price on this item fat shipment and good solid quality. I would buy again.,baby products,nursery,furniture,29,toys games,False
37074,B0006TIAVG,My Lip Stuff- Tube - Over 600 Lipbalm Flavors Available,A3DP3I3582LXUS,3/4,2.0,1332979200,The zombie flavor is just gross. The chap stuck its selfs is smooth and nice but I couldn't get over the smell of this flavor.,health personal care,personal care,lip care products,25,grocery gourmet food,False
229,B0000532Z0,"Kiss My Face Moisturizer, Olive & Aloe (4 Fluid Ounces)",unknown,0/0,5.0,956448000,"I love all the Kiss My Face products! They're all of such good quality (and I love the fact that they use natural ingredients). The Kiss My Face Olive and Aloe Moisturizer was the same -- excellent! It made my skin so soft, it wasn't greasy and had such a nice, subtle fragrance. I'd recommend it to all!",beauty,skin care,face,58,beauty,True
39446,B000IUOBM0,Wisdom Herbs (formerly Wisdom Of The Ancients) SweetLeaf Liquid Stevia,A2HCKBBEXELJ3R,1/1,5.0,1342224000,"Stevia has been my favorite sweetener for many years and Sweet Leaf has the best quality and best selection from my experience. There is variety of flavors to choose from and even though the flavors are not overwhelming, they add a nice, subtle little undertone to the taste.I have always loved chocolate ice cream (Rocky Road for example) with raspberry sauce drizzled on top. One of the best combination of flavors on Earth!!Even though some people claim they do not like the taste of stevia, to me, the benefits of using it compared with the risks of white sugar or artificial sweeteners are well worth. It could also become an 'acquired taste'. A friend of mine started off hating even a hint of stevia in his tea... then became gradually accustomed to it after white sugar was banned by his health practitioner. For me, the taste was 'love at first sight'. Always loved it and always will.Key is to use only very little (drop or two) and then add more as needed.Not necessarily the best thing for baking, however for sweetening any beverages or smoothies, or even making your own healthy delicious chocolate truffles, this has been my number one choice!",health personal care,nutrition wellness,vitamins supplements,201,grocery gourmet food,False
11941,B00028NF0M,"Luna Bars, 1.69-Ounce Bars",A2G033HZ2B2UJ7,2/2,2.0,1198713600,"This is a product that I normally buy in my grocery store, so I know what fresh ones taste like. The ones delivered by Amazon.com were dry and broken up in pieces.This has never been my experience with other products from Amazon....",health personal care,health care,women s health,42,grocery gourmet food,False
14893,B000KPML3E,Powerstep Pinnacle Insole,A6WYD3D8C2KU7,15/15,5.0,1218758400,"I had a problem with Plantar faciatis, and my foot doc recommended an orthotic. I bought these both locally and online and I love them!! I pulled the stock insoles out of my Nikes and installed these, and everything feels great. I bought three pairs, one for my running shoes, one for work, and one for my yard work shoes and I'm very happy! My Plantar faciatis seems to be improving, too! But even if it subsides completely, I will stick with these because they feel so good!!",health personal care,health care,foot care,88,baby products,False
