,productId,Title,userId,Helpfulness,Score,Time,Text,Cat1,Cat2,Cat3,tokens,keyatm_label,Accuracy
21773,B000EQHK3A,1-2-3 Treehouse - V.Smile SmartVille Imaginative Play,A6964G20W6WKJ,0/0,3.0,1265155200,"There are many parts to this toy that don't attach well. The little fence was lost within days and the shape sorter was taken off because my daughter couldn't figure out how to put them in because of the awkward angle. The little animals, although it's nice that there are a lot of them, have no place to be stored. I now have to have a specific storage container just for them. As others have mentioned, the ""up and down"" is extremely obnoxious and will override the other songs that are playing and, even worse, the animals have to precariously balance in the swing. We bought it for my daughter who has not outgrown it and my son has now grown into. Being a second child, there are many more options and he rarely plays with this toy even when I bring it out specifically for him to play with.",toys games,electronics for kids,systems accessories,150,toys games,True
4434,B00022WC1Q,Vidal Sassoon VSCL900 Professional Cord/Cordless Hair Clipper Kit,AS42SV2WZ6M9U,2/4,5.0,1121817600,"I bought the clipper because my son's hair grows like a weed. I got the kit and watched the DVD....I have never used clippers to cut hair before and was a little conserned that I was going to mess it up. I used the different combs included in the set and it was really easy to do. His hair looks great and other people think that he went to a barber to have it done, and that was only my first time using it. Thank you for this awesome product, my son will look better and I will have more money, since I do not have to take him to the barbers all of the time now.Mickella",health personal care,personal care,shaving hair removal,117,health personal care,True
22969,B000CPJPT0,Loreal Hair Fixer 6 applications,A3SOM6MLGVE823,2/2,5.0,1272067200,"I've used this product before, so I knew how it would work, but I've never left a review so here it is. I think this is a good solid product. It's not magic, but it does gradually improve the condition of your hair over time. For the people who say it doesn't work at all--yes it does. Possibly your hair was just too damaged for this to help you. There is a point when you've abused hair so much that the only thing you can do is cut it off.I've had color treated and permed hair off and on since I was a kid. Anyway, the last year I've done a lot of lighter colors--peroxide and ammonia really rip up your hair. I've had some very light breakage, weird frizziness only in certain places, and over all my hair wasn't as soft as it used to be.I wasn't sure what to do, short of shaving my head, but I looked around online (especially Amazon) and found this product. I bought it, it shipped promptly, and I really thought it improved my hair's condition. It probably took 3-4 applications to see the results promised. 1 application helps, but 3-4 is what it takes to truly glue hair back together at the strand level. I hope it hasn't been discontinued. The last seller I bought it from canceled my order with vague information that they had no idea when they'd get more from the manufacturer. So if you read this, my advice is to stock up.",beauty,hair care,hair scalp treatments,254,beauty,True
28806,B000GL1DZO,Accoutrements Lunch Lady Action Figure,A89ZZKNDFQH23,0/0,4.0,1301961600,"My ex-hubby left his field as a Professor of Masters students to be a lunch lady. We have a very amicable breakup and I'm still a bit of a sassy thing, so for a monumental occasion this year my son and I gave him the lunch lady. Thing is, he plays with it. Not like an action figure, but he will change the menu out for the lunch lady to serve.This is a hoot. And my ex is a good egg for taking the ribbing. So bring on the lunch lady in her glorious hair net and ice cream scoop and start serving the kids. In addition to the lunch lady we gave him the horror film stock charcaters, so that when the lunch lady sets out the day's meals the 'students' all look horrified. It's truly awesome in a sick way and my 9 year old likes to make diaoramas of the horror show that is lunch.To really add to the food fun, might I suggest Mr. Bacon vs. Monsieur Tofu Action Figures or perhaps Captain Corndog vs. Baron Von Broccoli.",toys games,novelty gag toys,unknown,182,grocery gourmet food,False
12044,B0002603RC,Melissa & Doug Toys - Sound Puzzle,A2NBKS27M3ORAC,0/0,5.0,1198972800,My daughter loved this product. She used it over and over again. I wish they would create a product that had numbers from 21 to 100. Highly recommended for children with Autism or speech delays.,toys games,puzzles,brain teasers,35,toys games,True
1420,B00005YWN0,Summer Infant Baby's Quiet Sounds Video Monitor,A1NV6ZG3J06VRT,7/7,4.0,1051056000,"I read some of the reviews and I too am a new mom who held on to the bassinet as long as possible. This monitor has a clear picture. Some of the reviews state ""too noisy"" well then lower the volume. I have no trouble with interference. Also another review stated this product didn't have infra-red to see in the dark. NOT TRUE!! I think this is a great product and would recommend it to anyone. It is also $50 or more less than the Safety 1st monitor",baby products,safety,monitors,88,pet supplies,False
28938,B000668QYU,"Clif Bar Builder's Bar, 2.4-Ounce Bars",AH0R88VXBLDU1,0/1,5.0,1302480000,"I LOVE the Peanut Butter Builder's bars. While Amazon is great for so many things, a trip to TJ's is too good to pass up. A little cup of coffee, a sample or two and into the cart with some fresh vegetables and whatever else is irresistible that day. Life doesn't get much better. If TJ's weren't local (perish the thought!), i'd order the bars from Amazon. With Amazon's sales volume, 2-day FedEx delivery and a sheltered place for the packages when they arrive, freshness hasn't been a problem.",health personal care,nutrition wellness,nutrition bars drinks,89,grocery gourmet food,False
27302,B0002ZS20I,Clevercat Top Entry Litterbox,A2O8Z4MX4I8WYT,0/0,5.0,1295395200,"We have had this litter box for about 6 months now and it works great. We were a bit unsure if the cats would take to the new design, but we followed the directions of having it side-by-side with our old unit for a while and they couldn't resist. The design is great for keeping the litter in the litter box. Our cats like to scratch and scratch and they often threw litter all over the floor near the old covered box. This unit does not have this issue. There will be some litter on the top of the unit, but that is by design and is not an issue.We don't use the liners for this, but just clean it out and periodically dump the litter for a new batch. When we do that, we'll wash it out, which is not a big deal. The unit is basically like a large storage bin with a smooth hole cut out of the top. Very clever design, which works well. It also keeps our dogs out of the litter box. Now if we can just find a way to keep them out of the cat food!If you are considering this unit, don't hesitate. It works well. Sturdy and solid plastic. Not the prettiest thing in the world, but heck, it's a cat box! What do you expect?",pet supplies,cats,litter housebreaking,225,pet supplies,True
504,B000046S2G,Safety 1st Grow with Me Portable Booster Seat,A1QNJD06GIN72O,3/3,1.0,1004313600,"This chair, appears to be very convient. Looks can be decieving. I purchased this chair for my one year old. It is made to be strapped on to a kitchen chair, which is pretty high for a 20lb child. My daughter was in her chair, eating breakfast when she leaned over to see our dog. The whole side of the chair snapped, and my daughter fell out of the chair and, on her head, face first. Luckily I was right there and she wasn't hurt severely.I hated this product, and don't recommed ANY parents to buy this for their children.",baby products,car seats accessories,car seats,100,baby products,True
28566,B000NHSAVQ,Merkur Classic Safety Razor with Open Tooth Comb,A37JNE9W4CZ5R1,4/4,5.0,1300924800,"I for one have never really liked my electric shaver, I have tried four or five different styles of them, they are convenient to be sure, and they do an ok job, but they are expensive, and when it's time to replace the blades, it's usually cheaper just to buy a new razor. I've also tried a number of the ""multi-blade"" razors out there, and found that one blade gets just as close as five. My fall back go to razor has always been a bic sensitive skin disposable razor. They are inexpensive and always perform and get closer than any multi-blade or electric razor ever could. I then decided to try a straight razor, the Parker SR1 Stainless Steel Straight Edge Razor to be exact. I didn't want to try an expensive one or one that required sharpening and stropping, because I really wasn't sure how it was going to work out for me. Long story short, I almost cut my head off on more than one occasion, so I retired it and chalked it up to my inexperience with that particular type of razor. It is a good razor and uses disposable blades, but just not for me. Then I decided to try the old school safety razor, specifically this one. It is very solid, heavy, and smaller than the bic disposables I'm used to, but then again I never really grabbed a razor with my whole fist either. I have to say that this is by far the best razor I have ever used. I shave daily and can forsee using this daily, and I can also see that it would work well with thicker beards and moustaches as well. The weight is nice as it makes shaving easier, smoother, and more fluid, I can say that I honestly shave faster, get a cleaner shave, and no nicks, tugs, or cuts with it. It is the most perfect shave I have ever had.",health personal care,personal care,shaving hair removal,326,health personal care,True
33651,B0006II760,Nature's Secret Woman's Whole Body Daily Multi Vitamin,ARBDSUQARO3F4,2/2,5.0,1322265600,I was alarmed when I first saw the size of these vitamins but I am pleased to say that they are easy to swallow with a morning smoothie. No after taste or stomache upset. My skin became flawless within five days of taking these. Very pleased.,health personal care,nutrition wellness,vitamins supplements,46,pet supplies,False
10910,B00023ZZ5U,Natrol (incl Laci Le Beau Teas) Natrol Melatonin,A2V7VGMR7WP1R2,1/3,4.0,1190764800,"Mayb 3mg, is too much for me.. I didn't sleep very well with the 3 mg pill, the divided into 4 pieces, and is ok.",health personal care,health care,sleep snoring,25,pet supplies,False
8723,B000056JND,Philips Avent 3 Pack Bottles,A1YZJS02NOOQEZ,2/3,5.0,1172361600,"These bottles are great! My breastfed baby took to them very easily, and now that she's older, the 4oz size makes a very good container to put cereal and other solid foods in (with the sealing discs). A benefit to these bottles is their ability to effectively and easily reduce the amount of air the baby swallows. As she is drinking from the bottle, you can actually see the air bubbles being released into the bottle in between sucks.In response to other posts about the bottles leaking, we have only used these bottles, and they have never leaked (even with mommy hurrying to pack bottles when running late). I have even dropped a bottle full of milk on the floor (several times), no leaks!I love that you can interchange the nipples and sealing discs, so I can have bottles or storage containers, depending on what I need! I also bought the Avent Breastpump Conversion kit ($9), so I can use my Medela pump to pump directly into the Avent bottles.All the bottle parts are dishwasher-safe, but I choose to clean the nipples myself with a nipple brush, just to be thorough. The rings, sealing discs, caps, and bottles themselves clean up very well in the dishwasher.These bottles are durable! Like I said, I have dropped them on the floor, pumped into them, run them through the dishwasher, sterilized them, boiled them (before I had a sterilizer), and they don't show any signs of wear at all! The bottles themselves are a very hard plastic, which can go through several babies without any problems. The nipples are a softer silicone, but are thick enough that they hold up great too.",baby products,feeding,bottle feeding,279,baby products,True
8586,B000AX24EW,Philips AVENT Isis iQ Duo Twin Electronic Breast Pump,A1HTAJ8CIYJB26,4/4,4.0,1171238400,"I've been using this pump for the past several months and have been happy with it only because I have nothing to compare it too. I do agaree with everything the prior review said for Pro's and Con's. I do like the petals since without them my nipple gets sucked all the way inside. If the suction is too hard it does become painful but then you can just decrease the suction. I found that at the end of each pumping session I have to massage each breast while the pump is active to get all my milk out though. I'm not sure if this is due to the pump or maybe my breasts are not fitting in the petals/cup correctly. It just prolongs my pumping time.I can deal with all that but I would say the biggest draw back for me is the freezer storage system. I work over an hour from home and are gone for over 10.5 hours. The freezer gel packs last a maximum of 6 hours - I've experimented with this including putting the entire themal bag in the freezer but that didn't lengthen the time. Since the thermal bags are such an odd vertical shape, I can't find any regular liquid freezer packs that are small enough to fit inside the bags. My job offeres a lactation room which has a small refigerator - thank goodness for that -but I'm still going to have a major problem in the summer when I have to travel home in the hot weather and when I have to travel to remote locations. The small gell packs are a major pain since there are so many of them.I can rearrange the parts in the center of the bag so that I have a small horizontal space to fit a different thermal bag. Right now I'm searching for a small bag like that which will fit inside this space and which I can use liquid freezer packs plus fit 2+ 9oz bottles inside - so we'll see. I contacted Avent about this and they offer nothing else.I also need a car adaptor which they currently do not provide but said they were working on it. They have no battery available.Before I purchased this pump I did research between Medella and Avent and thought both were comparable but the real quirks don't become apparent until you start using it!",baby products,feeding,breastfeeding,399,baby products,True
29857,B000Q0XL2I,Optimum Nutrition Whey Gold Meal,A15QC96SQW4ZUM,2/2,4.0,1306713600,"this has an excellent flavor (chocolate) and excellent ingredients, which is really the primary factors for me. i give it 4 stars because its pretty thick. i use a shaker bottle with a wire whisk ball and it still doesn't break up all the chunks. they are small, but still there...no matter how long i shake it up. so i tried a blender, which was a big mistake. the volume of liquid doubled. a half blender turned into a full blender, with no cup in the house nearly large enough to hold that concoction. took me about a half hour or more to drink a very large amount of thick, air entrained liquid. stick with a shaker bottle, it's much better. and the little chunks go down easy, as they break up well in the mouth and are still yummy in their own right. if you like the consistency of a mcdonalds milk shake, you'll like this stuff. but i have 2 other types that shake up smooth as silk, and they are awesome. they aren't meal replacements, but they are both high quality protein drinks. one of them is the french vanilla creme optimum nutrition 100% whey gold standard. absolutely incredible stuff. so in comparing the thin vs. thick, i really love the thin, and really like the thick. perhaps the whey gold meal is thicker because its a meal replacement, and also is not made with instantized whey protein. all in all, a very good product with excellent flavor.",health personal care,nutrition wellness,nutrition bars drinks,251,grocery gourmet food,False
35970,B000099SKD,"Energizer C Alkaline Industrial Batteries, Box Of 12",A12QO6TRKOOPU0,1/1,1.0,1329004800,"These batteries were inexpensive and industrial strength, but after using the last 4 batteries and thinking the other batteries dying was a fluke it is apparent that these are either old or just very bad product. I rarely if ever have any problems with any product purchased through Amazon but this one was not good. The batteries used before I replaced them lasted a year. I couldn't get more than a few weeks out of any of these.",health personal care,household supplies,unknown,78,health personal care,True
29971,B00005JD6C,Wash 'N Wear Barbie Doll w Color Change Outfits (2000),A2W4ST4L33BWXF,0/0,5.0,1307145600,"This is more popular with the granddaughters than I expected. Wind-up the washer & it will spin with the appearance of washing clothes. The washer doesn't actually spin any clothes. The front loader door doesn't open. However, the top lid does open. You can put a little water in there & put the special clothing in & within a few minutes, those special clothes change color (they resume their original color when dry). There's enough room in this washer for 3 small outfits. The laundry cart has wheels that move & the string for the clothes line is functional in holding 2 pieces of clothing on it with the cute clothes pins. Adorable doll & accessories. Note",toys games,dolls accessories,playsets,117,toys games,True
38106,B000KJZOWU,Leachco Snoogle Mini Compact Side Sleeper,A191SZNAM7S1VF,3/3,4.0,1337212800,"I ordered the Snoogle Mini because I really wanted all the features of a body pillow except I didn't want it to be under my head too. I wanted to keep the head pillow I am currently sleeping on. This was perfect for that! It is just the right size, not too small as other reviews have said. I am 5'7"" and average weight and I can put the very curly part between my knees and still hug the top. That may change as my pregnant belly expands, but I still expect to get good use out of this pillow.I did not find the cover too difficult. Or, rather, I should say my husband did not find the cover too difficult. As soon as the pillow arrived he insisted that we wash the cover before using it in our bed. I told him about all the reviews saying how hard it was to get the cover on and off. He peeled the cover off, washed it and stuck it back on. As long as you are systematic about putting it back on, you're fine.Also, I was able to stuff this size into a large tote bag and take it with me on a weekend trip to my in-laws. And it curls up so that I can lean against it to read in bed at night.I gave it four stars, not five, because some nights I feel like it is too thick between my knees and once I woke up with hip pain, but that might just be the way my body was changing or tweaking on that particular night.All in all, I am very happy with my purchase.",baby products,pregnancy maternity,maternity pillows,278,health personal care,False
5474,B00083HKDY,Hot Wheels Ferrari X-V Stunt Racer Challenge Track Set,unknown,7/7,5.0,1134864000,This toy is fun to play with. But sometimes the car might skid of the track or fall of the flexloop.But sometimes it makes 2 or 3 laps so it is a fun toy anyway.,toys games,vehicles remote control,vehicle playsets,35,toys games,True
10005,B000OWN65U,"Alli Weight-Loss Aid, Orlistat 60mg Capsules, Starter Pack",AVJJ2D4G5I0Z4,119/155,4.0,1183248000,"If you're looking for non-surgical ways to lose weight, the best track is FEWER CALORIES & EXERCISE. Eating smaller meals is one way to reduce caloric intake. Eating the same size meals with fewer calories is another. Or, lastly, stop the food that you injest from actually being absorbed by your body.Alli works on the principle of the latter, by blocking your body's ability to digest injested fat. And, in contrast to a lot of ads you might see on television, IT WORKS! YAY! I really have to congratulate whatever scientists actually figured out how to do this.Ok, but here's the downside. IT WORKS. Your body doesn't digest the fat, so it just goes through the rest of your digestive tract... and causes all sorts of unpleasant side effects along the way. They're really unpleasant. Seriously. I can't begin to convey how remarkably unpleasant they actually are. No matter what you heard, you will not be prepared. I actually took prescription Orlistat when it came out a few years ago, and, after stopping due to the side effects, I was *still* not prepared when I started Alli again recently.On the other hand, the side effects give you this great incentive to stay away from the pizza & deep fried chicken!!!For me, I eat remarkably healthy most of the time. I try and basically eliminate the need for Alli. But every so often, I get dragged to a business/social dinner or have to travel with few healthy food options available to me. In those cases where eating poorly is totally unavoidable, it's really nice to have Alli in my pocket.",health personal care,nutrition wellness,weight loss products,269,grocery gourmet food,False
39753,B000E1VF8Q,"Kay's Naturals Better Balance Kruncheeze White Cheddar Cheese - 1.5 Oz, 6 Pack ( Value Bulk Multi-pack)",A10A216DR5NUTJ,0/0,2.0,1343260800,I ordered these based on the positive reviews on amazon as well as I had been satisfied by other products by Kay's naturals. I found the cheddar cheese taste to be ok but the problem was that over 50% of the crackers in the bag have been crunched and it makes it difficult to eat. I canceled my subscription to the crackers. The box arrived intact and well packaged but the inside items were still crushed.,grocery gourmet food,snack food,unknown,76,grocery gourmet food,True
34952,B000P275WO,Bijan Black for Men Eau de Toilette,A1XYP6XZGO1J6,0/0,1.0,1325980800,The nozzle that the cologne sprays out of broke on me so not I have an empty bottle of brand new cologne its still attached and everything it just won't spray out.Thank you,beauty,fragrance,men s,33,beauty,True
24923,B0000959LU,Igia Straight N-Go Mobile Hair Straightener AT7351 - 1 ea,A36PNCA637MV8W,2/2,1.0,1284422400,"this iron does not get hot enough to do anything for my hair, i have very thin hair, its not that hard to straighten and it does absolutely nothing to my hair, very unimpressed. it doesn't seem to hold a charge very long either.",beauty,hair care,styling tools,44,health personal care,False
10120,B000LNJBQ0,"Graco Pack 'N Play Playard with Bassinet and Changer, Clara",A2UYFN90KEG9VH,32/32,5.0,1184284800,"We bought this pack n play after purchasing and returning an evenflo playard. We had one pack n play in the upstairs of our home from our first child and wanted a second one to have downstairs. The bassinet is quite sturdy, and all the pieces lock properly without to much effort. We didn't even need to use the instructions when setting it up. Plus it came with a mobile, a music station and a storage space for diapers and such. All in all a nice item, that can work for a girl or boy, definatley would recommend it!",baby products,gear,playards,99,toys games,False
32240,B000ELVZB8,Worldwide - Pure Protein Shake - 12 Bottles (11oz each),A3GOHJWFN5DMQQ,0/6,1.0,1316736000,"The shake is watery and makes me want to chug a gallon of bleach to remove the horrific aftertaste. It also contains soy, which is an ESTROGEN! I just bought these for the extra protein, but if I were a guy interested in building muscle, the last thing I'd drink is something with (essentially) estrogen in it (which, by the way, is also bad for women to consume, unless you like cancer). Even if you don't find the taste as foul as I do, do some research before you consider eating hormones (i.e., soy). It's my fault for not reading the ingredients, but this product does not deserve favorable reviews with regard to flavor. *Shudder*",health personal care,nutrition wellness,nutrition bars drinks,115,grocery gourmet food,False
13248,B000NNCI68,Petri Dishes with Agar and Swabs - Science Fair Project Kit,A2BE64VRVM605M,17/19,4.0,1206489600,"We bought this product for my son's third grade science fair project. They worked very well, we microwaved the agar and poured it into the dishes. After they cooled and gelled, we swabbed different places around the house and stored the dishes in zip lock bags. A couple of days later we had bacteria growing. I would recommend this product, directions were easy to follow and experiment worked.",toys games,learning education,science,68,grocery gourmet food,False
2050,B0001FUTZU,My Lip Stuff- Tube - Over 600 Lipbalm Flavors Available,A30A0FSJTR8M8T,4/5,5.0,1072742400,"So far I have about 30 of her balms, and 1 Body Butter Stick. They are all fabulous! The balms are smooth and leave a subtle shine on your lips. The scents are very true to their names. My favorites are probably Margarita, Coconut Lemongrass, and Brown Sugar and Cinnamon. I've reccommended My Lip Stuff to all my friends, and I highly reccommend it to you!",health personal care,personal care,lip care products,66,beauty,False
11016,B000F0VZV8,"Richell Wood Freestanding Pet Gate, Large, Autumn Matte Finish",A1LBB6C3EF7IJG,1/1,3.0,1191628800,"The pet gate is made well and looks great. However, not high enough for lab puppies once they figure out they can leap over it. We purchased three gates to block entrances into the family room and study, the puppies are 5 months and clear the gates like reindeer.The gate should be higher. I am a bit disappointtednow that the dogs can jump over them.",baby products,safety,gates doorways,65,pet supplies,False
