,productId,Title,userId,Helpfulness,Score,Time,Text,Cat1,Cat2,Cat3,tokens,keyatm_label,Accuracy
979,B00005BX8Z,Symphony-In-Motion Mobile,unknown,0/0,5.0,1034294400,My 2 month old loves to watch this mobile---it gives my husband and I at least 15 minutes to get things done while it entertains him. It is also easy to detach the mobile part while keeping the music part attached to the crib for when he becomes a little overstimulated by it. The batteries lasted quite a while---maybe change them every 6 weeks or so.,baby products,nursery,nursery d cor,66,toys games,False
4727,B000067QMJ,Fisher-Price Royal Potty,A1C2E7Y1GYHAZ5,0/0,1.0,1125273600,"My 2 yr old boy recently started using this potty - he loves it and the sound it makes - but this thing leaks terribly out the front and I end up cleaning up a pee pee mess on the floor and on the potty itself.Do yourself a favor, if you have a boy, do not get this potty.",baby products,potty training,potties seats,59,baby products,True
295,B00002QUO3,Madeline Talking Doll,A31O1VV8UW1EQG,31/31,4.0,967852800,"We love Madeline and got her for our 2-1/2 year old daugher last Christmas. She is very cute and her voice is very clear, however, the body is ragdoll and the head heavy plastic, so it is awkward. Also, my daughter desperately wanted to be able to take the hat off (it is attached). I have had to tie the hair back several times, as it comes loose and hangs in Madeline's face.We like the doll, but I feel my daugher would have played with it more if the hat were removable and it was a little more comfortable to snuggle with (hat is a pain).",toys games,dolls accessories,dolls,106,toys games,True
7465,B00092CXCC,Bob the Builder - Deluxe Talking Tool Belt Set,AOQGM1PAKQCG1,2/2,5.0,1164672000,"My 18 month old has just loved this set. Tool quality is excellent and they have held up well to several months of fix it jobs around the house.Tool belt is a bit funky; not something that my child has taken too. The hard hat doesn't tend to fit real well because it doesn't have any internal adjustments. These haven't been big problems for us, just something to consider if you think your little one is dying for the belt and the hat.My only minor complaint is about the hammer. They did such a lovely job with with the soft blue rubber on the tool handles but they should have include a soft rubber nose on the hammer too! Would have made Daddy's life just a bit easier and kept Jr. out of trouble with the hammer.",toys games,dress up pretend play,pretend play,137,toys games,True
16829,B000248HLI,INTENSIVE CONCENTRATE FOR EXISTING STRETCH MARKS By STRIVECTIN,A19TUJYDTDA8VO,1/3,5.0,1231718400,"I have used StriVectin-SD for a few years and I can't do without it. I'm 52 and both my mother and sister asked what I was using on my face as it looked much smoother. I use it faithfully twice daily, in the morning on my crows feet and forehead and in the evening over my entire face. The only downside is I have oily skin and it is a bit heavy. I have tried many different brands and found StriVectin-SD works best for me. It may be a bit pricey but as they say ""I'm worth it"".",beauty,skin care,face,98,beauty,True
26917,B0006O0I2U,Dr. Hauschka Skin Care Deodorant-Floral Fresh-1.7 oz,A2WWYY6NYLZN8T,0/0,5.0,1294012800,"This is my permanent deodorant, I won't use anything else. It smells like heaven. It probably doesn't work as well as powerful anti perspirants but also, it is not potentially unhealthy, so there you are. It works for me!",health personal care,personal care,deodorants antiperspirants,39,beauty,False
7120,B00080VMKY,Dora Knows Your Name,A2PG8DD9NATE00,12/13,1.0,1158796800,"My daughter's birthday was to take place the next day. At 10pm I went to Wal-Mart, and after seeing on the package ""over 100 songs, stories, and games"", I thought this would be AWESOME! I bought this toy excited that the doll would actually sing happy birthday the next morning to my 2 year old!I installed the software on my desktop (XP machine), but the real headache came when I hooked this thing to the computer (and I am a computer guy, so it shouldn't be that hard). I plugged in the doll with the USB provided cable, and Windows XP loaded the update to the drivers for the USB port. I clicked ""Download to Dora"", and the system came up with the ""Incorrect Doll"" that another reviewer mentioned. I tried Fisher Price's help files, but it was no help (in fact, it said call their customer svc department).Following another reviewer's instructions to try this on a new computer, I loaded this software on my laptop. Hooked the doll in. Had Windows XP update the USB driver. Then with great anticipation I clicked ""Download to Dora""....and.....and.....I received ""INCORRECT DOLL""!Finally, at 1AM...I gave up. I took the doll back to Wal-Mart. She got a nice tri-cycle instead.",toys games,dolls accessories,dolls,206,toys games,True
9101,B00025G1OW,Youngblood Ultimate Concealer,A1DC6EZUA9PLCK,9/13,1.0,1175299200,"I couldn't wait to open my new Ultimate Concealer when it arrived. I thought I was getting the purest and most beneficial makeup on the market. But as I read the ingredient list, my heart fell.This is a complete list of the ingredients:Caprylic/Capric Triglyceride, Octyldodecanol, Euphorbia Cerifera (Candelilla) Wax, Copernicia Cerifera (Carnauba) Wax, Jojoba Esters, Polyethylene, Stearalkonium Hectorite, Propylene Carbonate, Ascorbyl Palmitate, Tocopheryl Acetate, Tocopherol, Allantoin, Propylparaben, DimethiconeMay Contain:Titanium Dioxide, Iron Oxides, CI 77499, MicaThis list was taken directly off of the package. Obviously there are many more ingredients than what is listed officially on this page or on Youngblood's website. Make your own decision about whether or not you are comfortable putting some of these ingredients on your face every day.",beauty,makeup,eyes,122,beauty,True
27032,B000A2BCI2,"PowerBar Energy Gel, Caffeinated, Chocolate, 1.44-Ounce Packets (Pack of 24)",A1667K9QX2RHHY,0/1,3.0,1294444800,"This product arrived 24 packs in a box. Two packs had leaks which caused a big mess upon opening. The damaged packs were identified and discarded. The clean up required gallons of water as the sticky gel surrounding most of the packs had to be washed thoroughly. I cannot imagine how the damaged packs could have been opened enroute, so the shipment must have left the dealer broken. Lesson learned, never buy bulk through the mail. It is too tempting for a unscrupulous dealer to unload damaged goods. So I saved nothing over retail cost by buying from this source. BTW",health personal care,nutrition wellness,nutrition bars drinks,101,grocery gourmet food,False
1350,B000058A39,Fisher-Price Baby Playzone,unknown,2/3,5.0,1048723200,"My daughter received this as a gift when she was 7 months and when she began trying to pull up, it would tip and often fall on her. She is a small baby, so it wasn't her size that did it. I had to eventually put it away until she was old enough to stand on her own, but now she loves it!!! She is constantly dancing to it, and the music isn't loud, annoying, or long. I would recommend this for babies who won't use it for balance. She did get her arm caught in it, but that only happened because she had stuck another toy (not the balls which are included) down in the middle and wouldn't let go of it !",toys games,baby toddler toys,unknown,124,toys games,True
27691,B0001DVURI,InStep Street Rod Pedal Car,ADKIM2ECCR9CR,1/2,4.0,1297036800,"This pedal car is adorable and made to last a long time. When putting this together we noticed the two front wheels wouldn't turn. We had to bend the frame that holds the petals and front wheels quite a bit to get it to work properly. Once it was all put together, it works well. I wish they would have made all gray and chrome parts either gray or chrome. It looks funny that some parts are chrome and others are gray.We are also making cushions for the bottom and back of the seat so its more comfortable.Overall, I think its adorable and my nephew is going to love it!",toys games,tricycles,scooters wagons,110,baby products,False
36642,B000127KHI,Punky Color,A1PW5XVXTZXPEW,3/3,4.0,1331596800,"This dye is not really better than others but it does the job. I typically go with Special Effects when I want very red result, but I picked this one up at the store to give it a try. It delivered decent results but did not stay as long as SFX or Manic Panic. This color is also a more orangy red than I like (I like a pinker rather than orangy red) but it does deposit a decent amount of red into my hair. The results are very vibrant but this product does stain surfaces and fabrics a little more than most. After seeing the results the first time, I decided to just use it in conjunction with a color depositing or regular conditioner. I mix it with whatever conditioner I decide to use and leave it in for about an hour or two and it conditions my hair while adding more pigment to fadded-out red. This is especially useful because red hair has a tendency to fade very quickly, but when this product is used regularly with my conditioner of choice, I can add more red without the effort of dying my entire head.",beauty,hair care,hair color,196,beauty,True
2501,B0000D9SR8,Safety 1st Tubside Bath Seat,A1IANEBSMVGHS9,77/77,5.0,1083456000,"When our six-month old was an infant, we bathed him in a typical baby bathtub, but he outgrew that one rather quick (he is a tall/heavy boy) and it was beginning to become uncomfortable for him, so we recently got this tubside bath seat for him. He sits inside a ring that holds him (up to what age, still remains to be seen), has room for his legs to stick out, while it gives us room to clean his head and back, and we can rotate the ring with him inside as needed.So far, he's loving it (I guess, the fact that it allows him to sit in water helps) as he can splash and play with his bath toys, while we can get him clean for his nightsleep. The two challenges we've found are cleaning his belly (since he's compelled to be pushing it against the front of the ring, trying to reach his toys) and getting him into the seat (getting his legs in the proper spots), but this last thing is something that almost ALL seating gear for babies have an &quot;issue&quot; with.In any case, two words of advice:1) Measure your bathtub, to make sure the seat fits it. I can see how some other reviewers might have had a hard time with this, since it doesn't seem to fit all sizes.2) If you get it, when you use it, never leave your baby unattended, no matter how safe or great it feels (which it does!)Otherwise, highly recommendable. Enjoyable for the baby, comfortable on the parents! :)",baby products,bathing skin care,bathing tubs seats,260,baby products,True
19319,B000FEF1V4,Philips Norelco T980 Turbo Vacuum Trimmer,A15JZ44NIVNDE5,0/0,5.0,1248998400,"I like this trimmer quite a bit. Feels well-made, big, and so far the battery life has been outstanding. The built-in vacuum may be the weakest part of it, but hey, it's better than no vacuum at all. As long as you go slowly it does a fair job of sucking up the trimmings, so even that complaint is really a very minor one. I haven't experienced any problems with the locking mechanism slipping down to a lower guard setting, and I apply a reasonable amount of pressure. Overall, great product, no regrets.",health personal care,personal care,shaving hair removal,93,health personal care,True
25991,B00014EGTG,"The Ultimate Life - Ultimate Meal The, 400 g powder",A1WBVT0HIBYWZ5,5/5,4.0,1290124800,"A friend purchased this product for me to try a few years ago. It works as promised. I don't--WON'T-follow instructions to the letter (2X/day? Organic apples, bananas, blueberries? Purified water?) And I'm not a die-hard health nut, so I don't mind adding in soy (milk), or dairy (kefir), or nuts (almond butter).Still, it's a lot of nutrition for the price (&lt;$1/meal); a bargain even if you factor in the added fruit. And an ""ultimate"" bargain if you factor in the supplements provided (vitamins, minerals, herbal supplements) that you'd need to buy separately. Probably should check these ingredients, though, to make sure you can tolerate them.There's no getting around the greens-flavored taste of this powder, but it's no worse than other superfood beverages. The product's website has some good recipes and suggestions. One I've used is similar to what's on the canister (minus the ""organic""), except I substitute vanilla soymilk for the water (flavor/thickness). I include 1/2 cup frozen raspberry/blueberry mix that changes the color from green to purplish and sweetens the flavor. (I know fresh is better, but--trust me--cold is what helps makes this concoction palatable.)After three days of drinking this for breakfast, I felt more energized. It's filling as a light meal would be (3-4 hours as opposed to the advertised 3-6 hours). Didn't really experience the ""detox"" side-effects that others have mentioned (at least nothing I wouldn't experience from a high-fiber meal), but I also chased it with a bottle of water.As other reviewers mentioned, this is a bit of a ""stone soup fable"" misnomer. If you add 1/2-cup berries, 1/2 apple, and a banana (along w/cup of soymilk), this will be a pretty filling, higher-calorie (but nutritionally dense) meal.It's completely organic, vegan, kosher, free of glutens, soy, yeast, salt, dairy, egg, and cholesterol. The protein (16 g) is from vegan sources (quinoa/millet, amaranth, brown rice, spirulina).Says it's unsweetened, but other astute reviewers have pointed out there's stevia (a natural alternative calorie-free sweetener). Had to run out to check the canister myself.If you can get past the flavor and find a recipe that works for you, I definitely recommend Ultimate Meal!",health personal care,nutrition wellness,vitamins supplements,353,grocery gourmet food,False
24864,B000AEGCO4,Carex Transfer Bench,A3HJSNYIUMISZA,5/5,5.0,1284163200,"I researched transfer benches and found this one. It arrived very quickly and was so easy to set up. My mom's health care people were all impressed with it. The legs were a bit short for the old claw-foot bathtub, but I bought the extension legs and now it's perfect.",health personal care,medical supplies equipment,bathroom aids safety,50,health personal care,True
1016,B00003XAKP,Summer Infant Ultimate Crib Sheet,unknown,10/11,4.0,1036281600,"I would definitely recommend this product to anyone who is tired of fighting with conventional crib sheets. Before this sheet, I would literally have to REMOVE the crib matress to change the sheet. Now, with just a few snaps, the ultimate crib sheet is on or off with no sweat! The top is soft just like a cotton sheet, and the bottom is waterproof, so your decorative sheet remains dry underneath. It did shrink just a tad in the wash, but with the elastic straps, it still works just fine. And one of my elastic straps did come off, but I just sewed it back on. For me, the convenience has far outweighed these little incidences. If they were a little less expensive, I would own many more!",baby products,nursery,bedding,128,beauty,False
37842,B000NZQEF2,Gymnic Rody Horse,A1DM7WH33VWRX5,0/0,5.0,1336089600,"My 2 year old nephew is a bit small for his age and so was not super steady on the Rody, but loved it nevertheless. He has cerebral palsy and the horse is supposed to be good for developing core strength - I can see that happening. We have to help him bounce on it by pulling on the tail. The ears make good handles for little hands.",toys games,sports outdoor play,pogo sticks hoppers,68,toys games,True
5548,B0001X0DR6,LeapFrog Fridge Farm Magnetic Animal Set,AZ2IBRT85SQ5J,1/1,5.0,1135728000,"This toy is awesome and highly recommended! My 11 month old son got it for Christmas and loves it! The pieces are easy to put in, when my son pushes it just slightly the song plays, and it has volume control. I absolutely love how mixing two different animals creates a new one. It rewards them for the effort and gives correct information at the same time. Even my 5 year old likes playing with it. If I could give 10 stars I would.",toys games,electronics for kids,electronic toys,84,toys games,True
7714,B000G99RWC,Sister of Barbie - Kelly,A3UR1R8UDQGXDJ,6/8,4.0,1167696000,"This is a cute toy with many small accessories not mentioned in the product description. Each doll has a blanket, toothbrush and pillow as well as a mask that coordinates with her pajamas. There are little DVDs and popcorn, cookies, soda, cups (only three cups for five dolls, though).If you have a three year old like I do, the cute accessories will get lost within an hour. These dolls do not have brushes and their hair gets very frizzy quickly. The shoes are mule style and fall right off. It might not be easy to tell the racial variety of the dolls from the picture, but all but one are white, and the other is of ambiguous race. Living in an ethnically diverse community, I found this disappointing.All in all, it is a very cute set with many accessories and it is a very good buy. Be forewarned that is is very heavily packaged and you will spend at least half an hour freeing the dolls and accessories from the box. I would say this would be more accurately for 5+ instead of 3.",toys games,dolls accessories,playsets,184,toys games,True
19857,B00081L334,PRI Freedom Trainer (Toilet Trainer) (White),AXWCN8OEK49WT,1/1,4.0,1252886400,My friend had this for her grandkids and they loved it -- so I purchased one for mine to use. The only bad thing is we have handicap toilets (sit taller) so this will not work for a taller toilet -- it only works on standard height toilets.So I gave to my daughter-in-law and she loves it -- saves cleaning up the messy pots that come with the tradtional trainers!,baby products,potty training,potties seats,70,baby products,True
19458,B000H5IEHO,"Flexi Expression Comfort 1 Leash, Small-Medium up to 44 Pounds, 16-Foot",A1D2LWH6HHOHEJ,0/3,3.0,1250121600,"The leash is very good, but my dog broke it within a week. Sometime when I walk him, he would turn around and bite on the leash. The cord for this leash is very thin. So he bit it off within a week. I have a cockapoo, 6months old.",pet supplies,dogs,collars,49,pet supplies,True
11983,B000PJEM00,World of Warcraft,A1NHNRO0M6FHJJ,3/3,5.0,1198800000,I am 32 years old and just received the Series 1 for Christmas from my In-Laws. I must say that this is definitely one of the more durable pieces of the set and the Weapon he holds stays firmly in place unlike the Warlock from the series.,toys games,action toy figures,figures,47,toys games,True
9091,B000JOQMHW,KidCo Adhesive Mount Magnet Key and Holder,A1K0STP87PFHTD,2/2,4.0,1175212800,"These work really well, but be sure to get a couple of the magnets, because we lost our first one and then we were all hosed for a while.",baby products,safety,cabinet locks straps,29,pet supplies,False
17627,B000324Y8E,Safety 1st Perfect Fit Gate,A3IWSPSVWH2W1I,0/1,2.0,1236124800,"I used this product in tension position, not mounting. It only works sometimes. the handle tends to stick in locked position almost always until you use all of your muscle jerking your arm and sometimes to regain the lock position. Is it just mine? Mostly it holds weight well but when its not set properly forget it. Did I mention all the force required in order to properly set it?",baby products,safety,gates doorways,70,baby products,True
31117,B0002ASCGM,"Van Ness CP7 Enclosed Cat Pan/Litter Box, Extra Large, colors are assorted",AOP5TUC7TTEY0,2/2,5.0,1311984000,"I have three foster cats and have a smaller version of this pan along with a booda dome. I've found though that only the smallest of the cats would use the dome, so all three were really using the small box. With the purchase of this, I've given away the dome and everyone's now using each box equally. What I like about this one though is that the sides and opening are very high and I get much less litter on the floor than I do with the smaller box. I'd highly recommend this product.Note",pet supplies,cats,litter housebreaking,95,pet supplies,True
25575,B000NKH0E6,Melissa & Doug Deluxe Wooden Folding Princess Castle,A91QIUHA07P5W,2/2,5.0,1287964800,We purchased this for our daughter's 4th birthday as she is a 'big' princess fan. She really enjoys playing with it and spends atleast a couple hours playing with it 3 -4x a week. A great investment. I would highly reccomend this product.,toys games,dolls accessories,dollhouses,43,toys games,True
30487,B000A7707O,Super Pet Chinchilla Chin-Chiller Granite Stone,AR7IE85FAUKRR,2/5,1.0,1309478400,"I just want to start out by saying the only reason this is getting a bad review is to deter you from buying it on this site. Amazon is the worst about sending items completely unprotected and causing them to be broken when they arrive. This item was shipped in a box far too big for it and the only thing protecting it was a single piece of bubble packaging on the TOP of the item, not on the bottom where it would need the cushion. I will say that my chin loves this thing, sleeps on it constantly. But it is very brittle granite. Not nearly worth the price. We have a big cage with 4 levels, so I've decided to put another one of these on the second level as well, HOWEVER, I am using one of those granite cutting boards instead. Its all the same to them really. They just like anything that keeps them cold. So go buy a small granite cutting board for 5 bucks and save your money.",pet supplies,fish aquatic pets,aquarium d cor,174,pet supplies,True
6656,B0000635WI,Leachco Snoogle Total Body Pillow,A3SC4CVOCGZHC6,0/0,5.0,1151625600,"I'm so appreciative of all the reviews on here recommending the Snoogle. Like others, I was skeptical about this ""miracle"" pillow, but was desperate to ease my sciatic pain. The positive reviews on amazon.com convinced me to take the plunge.I purchased the Snoogle in my third month of pregnancy. I am now almost 8 months along and very grateful for my Snoogle and the countless sleep-FULL nights it's provided me.The two most popular concerns on here seem to be size and scratchiness.Size-- yes, it's large but not overwhelmingly so. I'd continue using it even if I were sleeping in a twin-size bed!Scratchiness-- I'm usually very picky about scratchiness and am usually on a quest for the softest sheets and clothing. I can honestly say that the ""scratchiness"" of this pillow has never offended me.I highly recommend this pillow.",baby products,pregnancy maternity,maternity pillows,138,health personal care,False
15468,B0009YD8NS,Treat Dispensing Chew Ball,AK0CENM3LUM28,32/36,3.0,1222905600,"Everlasting Fun Treat Ball / B0009YD8NSI have several treat dispensing toys for my puppy, and I like this one the least. The design is very poor, in my opinion, at least compared to other treat toys we've used.To begin with, it is difficult to ""load"" the toy with food and treats because there are two identical loading holes, one opposite the other. This means that when I pour treats in, they pour right out on the opposite side. It's like filling a bucket with no bottom, and it's very frustrating. Eventually, you have to just find the biggest treats you can, and jam them in, which is a pain and a half. Not to mention the edges of the hole catch and grab at your fingers - fun!That brings me to my next point - you cannot put small treats or puppy kibble in here as they will fall out immediately. Only big fat treats will provide the dog a challenge, but fortunately the makers of this product make such treats and are more than willing to sell them to you. Which is fine, I guess, and I went ahead and bought some, but I prefer to fill my treat toys with at least some regular kibble so that the puppy doesn't just gorge himself on a bunch of rich treats all at once. Since this ball won't allow me to do this, it's now an occasional toy, not a reliable daily toy.Bottom line",pet supplies,dogs,toys,244,pet supplies,True
33589,B0002YIQEQ,"Wondfo Pregnancy Test Strips, 25-count",AYLCUGIVNM5EW,0/0,5.0,1322092800,You get what you pay for with these tests. I was able to get positives at 10 DPO ( at night). It does take quite awhile for the test to come out positive though. The ovulation tests work GREAT!,health personal care,health care,family planning contraceptives,39,toys games,False
12880,B0000Y3CMY,"Mederma Skin Care for Scars, Soothing Formula, Fresh Scent, 1.76 oz.",A1QVULAJYU8AIV,4/4,2.0,1203379200,"I had a c-section and as soon as the steri strips were removed after surgery I began using mederma. I used 3 tubes of the product over 2-3 months and I have a very thick red, raised scar. The surgeon performing the surgery is very skilled and the wound was closed properly. We both expected it to be barely noticeable in a few months. Mederma just didn't help to prevent hypertrophic scarring. I will use silicone sheets next time.",health personal care,health care,first aid,79,pet supplies,False
