,productId,Title,userId,Helpfulness,Score,Time,Text,Cat1,Cat2,Cat3,tokens,keyatm_label,Accuracy
9784,B00006414P,EAS Myoplex Lite Nutrition Shake,A1WV2D91R87W9K,3/3,5.0,1181174400,"I love this drink. I put it in a blender and add bananas and ice (to make it cold like a milk shake) or any other fruit and even peanut butter. You can have twice as many drinks if you make them not quite as thick (use half a packet). I get the vanilla and add chocolate to make a chocolate drink. I make mine with plain soy milk (lactose intolerent). It tastes great and is low fat, low calorie and fills you up.",health personal care,nutrition wellness,nutrition bars drinks,84,grocery gourmet food,False
28503,B000EVGOOQ,Hask Placenta No-Rinse Instant Hair Repair Treatment for Extremely Damaged Hair Hair And Scalp Treatments,A28D61M9UQK9I7,1/1,5.0,1300665600,"This product is the most amazing hair repair I have ever used! I have worked in Salons for most of my life and used almost every product on the market for hair repair. Not only does it work famously though the condition of my hair and volume has increased and totally repairs my hair, and I have a lot of hair!...I have highlights for my hair maybe twice a year...anyway...just to mention...I could not find this item in the locals stores...so I tried another supposedly fantastic product and it did not work well, not nearly as well as this Hask Placenta Leave In Conditioner...I will never stop using it as long as it is still available for sale...I have been using it for many years now....without this product my hair is very limp and staticy...really awful...I can not do much with it and it does not even hold a good blow-out or rollers without Hask Placenta...and I am being very honest...my hairdresser always remarked how beauiful and lush my hair is with the Hask Placenta...I hope this helps?..and I hope they never stop manufacturing the product! OMG! I would be devastated and so would my hair!",beauty,hair care,hair scalp treatments,196,beauty,True
7638,B00008BFZH,Snap Circuits Jr. SC-100,A3FOLVRK0XPDXQ,3/3,5.0,1167091200,My 6 year old son LOVES this kit! He showed everyone in the family how to do the experiments soon after getting it for Christmas. The manual that accompanies the kit is very thorough,toys games,learning education,science,34,baby products,False
31712,B000IUOBM0,Wisdom Herbs (formerly Wisdom Of The Ancients) SweetLeaf Liquid Stevia,A2CGNMFEFL57Q5,1/1,4.0,1314489600,"I have tried two different brands of liquid stevia now. Sweetleaf certainly has more flavors, and it is not too strong. I was surprised at how small the bottles were in this 4-pack. All the flavors in this pack are good. The other brand that I have bought is a little stronger (fewer drops give a stronger sweetness) but once you get the taste you like, all is good!",health personal care,nutrition wellness,vitamins supplements,69,grocery gourmet food,False
27787,B000NV6D16,Melissa & Doug Elephant Plush,AEOEIEJQZXKC6,0/0,5.0,1297468800,"This has been a great gift and a very fun toy for my daughter, she has a little collection of elephants and this is the mama elephant to all of her little elephants. She has such a great imagination, something every kid should have and also the biggest smiles with her pretend play. Thanks!!!",toys games,stuffed animals plush,animals figures,54,toys games,True
16512,B000F4DKB2,"Twinings Lady Grey Decaf Tea, Tea Bags, 20-Count Boxes (Pack of 6)",A2H74FIBDN5NMR,0/0,5.0,1230508800,"This is a great decaffinated tea. It's very hard to find in the stores so I was happy to find it online. This seller sent it in a box, neatly packed. It took a bit longer than I would have wanted, but I think that was because of the holidays. Snow and all - overall, quite happy with quality and delivery of product.",grocery gourmet food,beverages,tea,63,pet supplies,False
14303,B000OLVJFA,CK IN2U For Women By CALVIN KLEIN Eau De Toilette Spray,A3R9H6OKZHHRJD,1/1,2.0,1214265600,"I'm not really a fan. What I get from this fragrance is amber and citrus, and the two bodies of notes aren't well mixed. They don't seem to work well together at all. This fragrance seemed to be in a constant state of discord- it just didn't gel for me.",beauty,fragrance,women s,50,beauty,True
15105,B000FWAP8A,The Da Bird Value Pack (Includes 1 Da Bird Original Single 3 Foot Pole Cat Toy & 2 Replacement Feathers),A2LNJP9QKH9JEQ,6/10,1.0,1220572800,"A $10 cat toy with $7 refills (my local price, or amazon + shipping) should last more than 24 hours. The stupid toy is MEANT to be pounced on and chewed, why isn't it made to tolerate that? One of four feathers came off it as we took it out of the package, the other 3 were gone by next morning. MAJOR rip-off!",pet supplies,cats,toys,63,pet supplies,True
24395,B0000532QB,Clearblue Fertility Monitor 1 Count,A1QSJ5CI3Q9BQJ,4/4,5.0,1281571200,"My husband and I decided to officially start trying to conceive in April of this year, and after reading all of the positive reviews, I bought this monitor. Coming off of the pill had made my cycles pretty irregular and I really didn't have any idea about when ovulation was happening. During the first month, the monitor was just getting to know my cycle, and I think our timing was a little bit off, so we didn't conceive. However, timing worked perfectly during the second month and now I am in my 12th week of pregnancy. The time window in the morning was never a problem, the monitor is easy to read, and though it can seem like an expensive investment, it seems like a such a small price to pay in exchange for quality, accuracy and the relief of knowing exactly what's happening with your cycle.",health personal care,health care,family planning contraceptives,147,baby products,False
33632,B00020I6I6,Source Naturals Life Force Multiple Tablets,A2YSA6RZMKD9LC,2/2,5.0,1322179200,The thing people don't always notice is that most vitamins require 6 pills a day to reach the values they post. These vitamins only split the values in half so 1 pill a day is plenty. This will be my go to multi for as long as they make it.,health personal care,nutrition wellness,vitamins supplements,50,pet supplies,False
38035,B000G647Y8,Tweezerman Men's Shaving Brush,A2S6HXKYQM0KH7,0/0,5.0,1336953600,"What can I say, It's a brush right? A brush that's pretty cheap right? Like the one you can get at the drug store (yes they sell them there too)Yes this is the same price as the one at the drug store HOWEVER, it's a million times better. This is BADGER hair, the one at the drug store is Hogs hair, yes man HOG.Who do you think would win the fight? Honey Badger or Pig?I kid, I kid...Seriously, this brush is great for the money, and it is real badger hair. If you don't trust me, that's cool. Get this one and the one at your local drug store, let me know whatcha think.",health personal care,personal care,shaving hair removal,114,beauty,False
28509,B000F1QVKC,Stork Craft Aspen Combo Dresser,A1IU2PNNMGL0J8,1/1,1.0,1300665600,"Okay, this dreser is a good price and looks nice in the picture. The parts arrived in good condition too. HOWEVER, you do not want to waste your money on this. It was a disaster. The instructions are terrible, holes are predrilled wrong, etc. However, despite that, we got it together. BUT, it was so, so wobbly. It would sway back and forth by barely touching it. You would never want to put your baby on this dresser with how wobbly it was! And the drawers were terrible - wouldnt line up correctly and there were gaps where they didnt line up with sides of the dresser. Ultimately, after spending the day putting it together, we had to take it apart at 9 pm, pack it back up, and return it to Amazon for a refund. It was a total waste of time and really frustrating. We ended up buying a better quality changing dresser from jcp.com - it was $100 more but arrived FULLY ASSEMBLED and looks awesome in our nursery.",baby products,nursery,furniture,172,pet supplies,False
9988,B000PQRJEY,"Lauren Hutton - Aqua Elements Introductory Offer, Olive (Medium Dark)",A36JJ68IBQVN20,0/0,3.0,1183075200,"I'm 37, light combination skin, I saw the product on tv, did a little research and decided to give it a try but it didn't worked for me, it clogged my pores, making me to break out. The package looks really nice but not a good quality, too expensive!! Try Bare minerals, love it!Es un producto demasiado caro es de mala calidada, reseco' mi piel y tapo' mis poros, tengo 37 y piel clara normal,no gaste su dinero, no vale la pena.",beauty,makeup,makeup sets,82,beauty,True
4673,B00003TL7P,Baby Trend Diaper Champ,AA5N9W24LKFKH,2/4,2.0,1124668800,"I don't think I would have bought the diaper champ if I heard how bad it smelled! I read all great reviews but I guess people must have left out how bad it stinks all the time. It does not keep odor out at all. I have scented trash bags in it and it still gags me when I walk in my daughters room. I think the way to open it is awfully hard too. I brake a nail every time or pinch my fingers. I don't think I would reccommend this to anyone. It helps save money because you don't have to buy special bags but for the extra money I would have gotten the diaper genie. Unfortunatly, I found this out too late!!",baby products,diapering,diaper pails refills,125,baby products,True
28362,B000CMKHR2,Coralife 01692 Digital Power Center,AHZRKYEN4Q5DG,0/0,1.0,1299974400,"I don't normally provide product feedback, but I felt compelled to do it this time because this product (Power Center - sold under Coralife Aqualight & other brand names) should really be off the market.First Problem",pet supplies,fish aquatic pets,aquariums,36,health personal care,False
7888,B000HVOOVS,Geomag Metal 42 - Blue Stock# 204BLME,A2IZTMHLT0BSCO,0/0,5.0,1168300800,"Geomags are an awesome product and very durable. I had read some reviews about other magnetic toys that break easily, but Geomags seem to hold up really well (maybe since they are Swiss made). We've had Geomags for over a year, the blue metallic ones are our latest addition. They are great for boys and girls and older kids, even parents like to play with them. My kids really like to use the Geomag Panels to finish off their projects. You can buy the panels as a set on Amazon or buy them in a pack w/ only squares, or triangles, etc. on other websites.",toys games,building toys,building sets,105,toys games,True
8215,B000BNJIUE,Boxers Or Briefs?,A1EA3YKTWAQNBQ,3/5,5.0,1168819200,"All of my friends and family love this game, and are always wanting to play or borrower it. So many people have looked for it in stores and have yet to find it, I say you have to buy it on Amazon.We have played with all types of friends and family, and even our grandparents who are in their late 70s love it, as well as cousins in there teens.",toys games,grown up toys,unknown,70,toys games,True
5409,B0000V0E14,Chillow Comfort Device,A2N4H4QD0DUCEV,9/13,1.0,1134000000,"I really looked forward to this product and had high hopes for it. My husband gets very hot at night and I thought this was the answer for him... I even decided to purchase one for myself as I had heard such good things about it.We used them for about a month - First we tried them inside the pillow case - that was useless - you cannot even feel any coolness unless it is ON TOP of your pillow. Also, it never really got cold - I had slightly better success by placing mine in the freezer for 20 minutes (my husband never put his in the freezer...) before I went to bed, however, when we awoke in the morning, the chillo was hot and so were we. (Also, having to remember to place your chillo in the freezer every night is a real drag!)Additionally, after about a month, my husband woke up around 1am drenched in water! It seems that the plug came undone and all the water came out! We let the chillo (and the bed) dry and then put water back in it according to the instructions. Aparently, there is some kind of chemical or something in the chillo, because refilling it was to no avail. We could not get it to work at all after that and it looked like a plastic bag filled with water (it never flattened out and ""absorbed"" the water again... and the instructions do not talk at all about refilling it...)I'm sorry I wasted my money on this product and would not recommend it to anyone...",health personal care,health care,pain relievers,266,health personal care,True
30087,B000MEB3GE,Itzbeen Pocket Nanny Baby Care Timer,A2Z2KQO83S9A6R,1/1,5.0,1307750400,"While I rely heavily on the reviews of others when purchasing online, this is my first time to contribute myself. This product is so fantastic that I thought I should take the time to create a positive review.My mother purchased this for me in a store after asking the saleslady what other new moms found very helpful. I was doubtful that I would find it to be extremely useful. Little did I know that I would become inseparable from my trusty Itzbeen! It was like my security blanket for the first 6 months of my son's life! The concept seemed so simple that I underestimated its value, but I see now that moms with tiny babies are so sleep deprived that this timer is very helpful in establishing a routine for your baby.A friend of mine told me that you had to stop watching the clock and read your baby's cues to put them on a schedule. This timer helped me identify that my son actually DID have a routine. Each day we might start our day at a different time, but once our day began, he really was like a well-oiled machine in that he was ready for naptime after the same amount of time had elapsed. He wouldn't nap at exactly 8:30 a.m., for instance, but he would always be ready to nap after he had been up for an hour and a half (just as an example). I didn't have to worry about remembering the last time he ate or how long he had napped - the Itzbeen remembered for me. This timer is also great for leaving your baby with a spouse, grandparent or sitter who won't be as familiar with your baby's routine.Another huge plus - it helps a great deal with the night-time feedings. I woke up more than once in a panic in the middle of the night convinced that I had skipped a feeding and my baby had been crying for 6 hours straight. I was so tired that I really couldn't remember our last feeding. I would look at the Itzbeen and realize that it had only been 3 hours and my baby was just waking up for his next feeding. As he began to sleep through the night for longer periods, it helped me see how long he was going between feedings, and that gave me hope. Because the night feedings were such a blur, I would not really have known for sure if we were making progress.I am now purchasing this for a friend as a baby shower gift. Everyone may not use it for as long as I did, but it is well worth the money for even 6 weeks of use!",baby products,bathing skin care,grooming healthcare kits,454,baby products,True
20156,B000NWGCZ2,"Vanicream Moisturizing Skin Cream with Pump Dispenser, 1 Pound",A3MWGFFHZPUA3H,0/0,5.0,1255046400,This is the only product that has helped my daughter's eczema. It is thick and the skin seems to stay softer longer once this cream is applied.,beauty,skin care,body,27,beauty,True
8372,B000088UPW,Melissa & Doug Puzzle Storage Case Single Wire,A35DIZ8Q6H4TD,68/69,3.0,1169251200,"Be aware... this product no longer includes the red rubber tips pictured in the description. I called Melissa and Doug and they said it had been some time since they changed the design. They recommended protecting my wooden shelves from the metal and could not tell me why the design had changed. The product is a nice storage solution for puzzles, but may scratch up surfaces as it slides around a lot. I put a rubber grip shelf liner underneath and that seemed to help.",toys games,puzzles,unknown,85,pet supplies,False
29533,B0007Q426U,Lindberg Snider Porterhouse & Roast Seasoning 14oz.,A3UB1N1Z15C66T,0/0,5.0,1305158400,"I first encountered this rub when applied by the gentlemen at Bisher's Quality Meats in Ramona, CA. I loved it so much I purchased a jar off their shelves. I have since moved and the jar is now empty.... Amazon to the rescue! This blend is the perfect complement to a fine cut of beef.",grocery gourmet food,pantry staples,herbs,55,beauty,False
11368,B00005JSB6,Huggies Snug & Dry Diapers,A1YAK0OI577RPG,0/0,4.0,1194825600,"Huggies make great diapers that work. They lose a star as I am not aware of a biodegradeable Huggies diaper.Our first child used Pampers which DID generate a smell as soon as they became wet. If I'm 20minutes away from a changing table I don't want a constant reminder nagging me for every second of that 20minutes. And if during that 20minutes the baby may poop/pee some more (which is fine, that's what the diapers are designed for) that non-biodegradeable gel is very effective in dealing with it and the impact on landfills lessened.",baby products,diapering,disposable diapers,94,baby products,True
30520,B00023ZZCS,Health From The Sun Borage Oil 300,A2EYRLHSTTARVD,2/2,5.0,1309564800,"I had never heard of Borage Oil until I visited my Estetician. She saw that my skin was very dry and recommended that I take Borage Oil capsules to ""moisturize my skin from within"". I went to Whole Foods and paid $27.99 plus tax for 300 MG/60 capsules. After a few days, I noticed that my exema was getting better and my skin felt softer. Because I didn't want to run out, I found the exact same brand, size, and mg's on Amazon for $15.99! Not only am I satisfied with the product because it really works, I will buy it on Amazon because it is a lot cheaper!",health personal care,nutrition wellness,vitamins supplements,109,beauty,False
10392,B0000ASPU7,InStep Fire Truck Pedal Car,A4G44FOM0CTLK,5/6,3.0,1186617600,"The product itself is a neat toy, but when we put ours together, a couple of the pieces were scratched to the point of dissatisfaction. It is hard to pedal. Our son will have to gain quite a bit of muscle strength in his legs before he will be able to pedal and by that time comes, he may be too big to ride it. For what we received for the cost of this item, I would not recomend this toy. Buy a bike instead.",toys games,tricycles,scooters wagons,85,toys games,True
31325,B000056J76,BABYBJORN Toilet Trainer,A2CFHI39NCSHQE,0/0,5.0,1312934400,I love this potty seat. I can't even begin to tell you how great it is. It's made out of sturdy plastic that seems as if it will last a long time. It fits snugly in/on the toilet with no problems. The adjusting mechanism is genius. It's super easy to clean and I don't have to worry about the seat absorbing any bathroom nastiness. It comes off the toilet quickly and easily for adult users and the handle allows for easy hanging. My son loves sitting on it and hasn't looked or acted uncomfortable during use. He has great confidence sitting on this seat. The splash guard isn't too short or too high and the hole is just the right size for my potty-training toddler. We haven't had any issues as of yet and I am thrilled to own this. We tried self-standing potty chairs as well as the seats that attach to the toilet. This is by far my favorite.,baby products,diapering,unknown,161,baby products,True
29276,B000J1FT4W,Third Generation Dr Mom Slimline Stainless LED Pocket Otoscope now includes True View Full Spectrum LED and Pocket Clip,A3RFQK4J18C9OJ,4/4,5.0,1304035200,It is a very handy and grate product to have. Save you many trips to Dr's office because you can know whether your child has ear infection or not. I am very against using antibiotic too often on ear infection.,health personal care,personal care,ear care,40,baby products,False
28700,B0007OD8SU,"Summer Infant Day and Night Handheld Color Video Monitor with 1.8"" Screen - Silver",A1GZWUKN9Y3M8Y,0/0,5.0,1301443200,"We bought this about 3 months before our daughter was born. I am now watching my daughter sleep on the monitor while I write this review. She is now 4 and a half years old. Besides the merits to have a video monitor (witch I highly recommend) this has been a perfect product. We have had to get a new battery for it but that is about it for maintenance (and to be expected after almost 5 years). I have dropped it at least 5 times (once from waist high on a brick fire place hearth, only months after we got it) and it is still working flawlessly. The range is amazing. I can go all the way in the back of our yard to do weeding (about 30-40 yards) and it still works fine through 2 stories and the brick exterior of our house. There has been no interference from any of our other devices since it runs in the 900 mhz range. We have taken it everywhere when we travel and have never had a problem. What a great investment for extra paranoid parents! I cannot recommend this more.",baby products,safety,monitors,191,baby products,True
33302,B00021AGN8,Fake Bake Self-Tanning Lotion,A3LWHZLQ3LHTIO,1/1,4.0,1320796800,"I have used almost every self-tanning product available. This product looks very real and doesn't dry out my skin. You Must be very careful when applying and rub it in well. It comes with gloves and if you don't use them, your palms will be tan too! Fake Bake is my favorite:)",beauty,skin care,sun,52,beauty,True
32690,B000HHO4DU,Super Pet Clear Water Bottle - 4 oz,A3MX63FHISNPQ3,1/1,3.0,1318464000,"Bought this to replace the small 8oz bottle we got with our rabbit cage. The larger size is a great improvement, and we love the spring retention band with the clips compared to the simple piece of stiff hooked wire on the old bottle.But there are a couple of annoying shortcomings:* Don't like the angle on the ""spout."" It's too wide or obtuse. If you hold the bottle flat against the outside of the cage, the end of the spout doesn't really reach inside the cage -- it's almost even with the side of the bottle! You have to insert the spout first and lever the bottle's top end which collapses the plastic a bit near the spout (see next complaint), so the bottle doesn't actually sit flat against the cage -- the top end angles away. This could be remedied with a slightly tighter bend in the spout, maybe 5 degrees more? I thought about heating it up and trying to do this myself, but would be afraid the metal would collapse at the bend, or the heat would distort the circumference and cause a leak around the ball or around the cap.* Plastic is very soft, causing it to collapse near the cap end where the cage bars compress it when the spring retainer pulls it tight. Again I think this is caused by the angle of the spout, which hits the cage bar underneath and applies pressure to this point when the retainer is attached. My concern is this crease in the plastic will eventually break through and leak.* Minor gripe with the little yellow floating duck that's supposed to serve as a water level indicator. It has a disk on the bottom presumably as a ballast to make it float upright, but it's not heavy enough. So ours looks like a dead duck, always floating on its side. Not really a problem, since the actual water line is more visible to me than the duck, but my wife thought it was a cute addition until it wouldn't float upright. You can remove the duck if you don't want it.As for those complaining of leakage, all such bottles like this I've seen will leak at first. You have to ""prime"" it after filling to get the vacuum to seal. After filling, hold it over the sink while you tap the ball several times. This releases some water and you'll see air bubbles rise in the bottle. After several taps it should seal and stop leaking. Problem is, again, due to the soft plastic and the angle of the spout, it's impossible to install on the cage without squeezing it, which inevitably causes some initial leakage into the cage. Have a napkin handy to catch the water while you re-prime. Once installed and primed, ours has never leaked.",pet supplies,small animals,feeding watering supplies,470,pet supplies,True
876,B000062X6L,Star Wars Attack of the Clones - Clone Trooper,A1N5YLBPLTWIN3,1/1,5.0,1027900800,i like it i love to collect star wars items i have a hole wall shelf full and this has just added the true fun you dont hAVE TO BE A KID TO INJOY AN GOOD TOY SUCH AS THIS I JUS T WOOD LOVE TO SAY THANK YOU,toys games,action toy figures,figures,49,toys games,True
12827,B00083HIKY,Classic Waterworks,AEVZZP02GFENZ,0/0,4.0,1203033600,"Waterworks will be the most fun for grown-ups who remember playing it as a kid. We played very competitively and actually ran out of cards before we finished the game. Kids can play because the rules are simple and they may enjoy springing leaks on the other players. The more leaks that you play, the longer the game is, as each player has to fix their leaks. If you play conservatively, the game can be over very quickly.",toys games,action toy figures,figures,78,toys games,True
14016,B000P9XTN6,"Walkabout Folding Deluxe Lite Rollator with Loop Brakes Padded Seat and Basket, Red",A33I7YPDSJ7GQN,4/4,5.0,1212278400,"My mother suffered a debilitating, adverse reaction to a medication which left her bed-ridden for months. With the help of this walker, she is slowly regaining her ability to walk.She was unable to use more traditional lift-and-scoot walkers; but now, rolls with ease around the house. While shopping, the seat provides welcomed relief when rest is required.I would recommend this product to anyone with family members who wish to regain their mobility and independence.",health personal care,medical supplies equipment,mobility aids equipment,74,baby products,False
